{
  "id": "pudding-bastion",
  "name": "布丁要塞",
  "version": 1,
  "rarity": "epic",
  "tags": ["summon", "turret", "evolution"],
  "description": "布丁炮台进化为布丁要塞，生成多点自动火力。",
  "requirements": {
    "weapon": {
      "id": "pudding-turret",
      "min_level": 5
    },
    "passive": {
      "id": "nonstick-apron",
      "min_level": 3
    },
    "trigger": "boss_chest"
  },
  "replaces_weapon": "pudding-turret",
  "weapon_definition": {
    "type": "summon",
    "targeting": {
      "mode": "nearest_enemy",
      "range": 520
    },
    "base_stats": {
      "damage": 26,
      "cooldown_ms": 550,
      "projectile_speed": 520,
      "projectile_count": 3,
      "pierce": 2,
      "area_radius": 18,
      "duration_ms": 7000
    }
  },
  "visual_description": "多个布丁塔组成甜点要塞，樱桃炮口轮流发光。",
  "sfx_description": "布丁炮台连射声和奶油糖弹 plop 声。",
  "unlock": {
    "type": "discover"
  }
}
