{
  "id": "rainbow-candy-meteor",
  "name": "彩虹糖流星雨",
  "version": 1,
  "rarity": "epic",
  "tags": ["projectile", "aoe", "evolution"],
  "description": "彩虹糖弹进化为周期性流星雨。",
  "requirements": {
    "weapon": {
      "id": "rainbow-candy-shot",
      "min_level": 5
    },
    "passive": {
      "id": "candy-crystal-lens",
      "min_level": 3
    },
    "trigger": "boss_chest"
  },
  "replaces_weapon": "rainbow-candy-shot",
  "weapon_definition": {
    "type": "burst",
    "targeting": {
      "mode": "random_enemy",
      "range": 620
    },
    "base_stats": {
      "damage": 42,
      "cooldown_ms": 900,
      "projectile_count": 8,
      "area_radius": 42
    }
  },
  "visual_description": "多颗彩虹糖从天空坠落，形成小型糖果爆炸。",
  "sfx_description": "连续 sparkle pop。",
  "unlock": {
    "type": "discover"
  }
}
